{
  "meta": {
    "game": "Chicago Bulls at Washington Wizards",
    "date": "2026-04-15T00:30Z",
    "season_phase": "PLAY_IN",
    "l10_order": "newest_first",
    "away": { "name": "Chicago Bulls", "abbr": "CHI" },
    "home": { "name": "Washington Wizards", "abbr": "WAS" },
    "extracted_at": "2026-04-14T18:00:00"
  },
  "team_stats": {
    "CHI": {
      "name": "Bulls",
      "DEF_RATING": 112.5,
      "DEF_RANK": 18,
      "OFF_RATING": 110.2,
      "PACE": 99.8,
      "NET_RATING": -2.3
    },
    "WAS": {
      "name": "Wizards",
      "DEF_RATING": 116.1,
      "DEF_RANK": 28,
      "OFF_RATING": 106.3,
      "PACE": 101.2,
      "NET_RATING": -9.8
    }
  },
  "team_dvp": {
    "CHI": { "D_FG_PCT": 0.471, "PCT_PLUSMINUS": 0.012 },
    "WAS": { "D_FG_PCT": 0.489, "PCT_PLUSMINUS": 0.031 }
  },
  "odds": {
    "spread_home": "+6.5",
    "spread_away": "-6.5",
    "total": "224.5",
    "h2h_home": 4.20,
    "h2h_away": 1.25
  },
  "news": {
    "CHI": [{ "headline": "Bulls confirm playoff push", "description": "Starting five healthy" }],
    "WAS": [{ "headline": "Wizards rest starters", "description": "Tank mode activated" }]
  },
  "players": {
    "CHI": [
      {
        "name": "Zach LaVine",
        "player_id": 203897,
        "position": "G",
        "gamelog": {
          "name": "Zach LaVine",
          "games_played": 65,
          "PTS": [28, 31, 22, 19, 35, 27, 24, 30, 18, 25],
          "REB": [5, 4, 6, 3, 7, 5, 4, 6, 3, 5],
          "AST": [4, 6, 3, 5, 7, 4, 5, 3, 6, 4],
          "STL": [1, 0, 2, 1, 1, 0, 1, 2, 0, 1],
          "BLK": [0, 1, 0, 0, 1, 0, 0, 1, 0, 0],
          "FG3M": [3, 4, 2, 1, 5, 3, 2, 4, 1, 3],
          "MIN": [36, 38, 34, 32, 40, 36, 35, 37, 33, 36],
          "l10_dates": ["2026-04-13", "2026-04-11", "2026-04-09", "2026-04-07", "2026-04-05", "2026-04-03", "2026-04-01", "2026-03-30", "2026-03-28", "2026-03-26"],
          "l10_matchups": ["CHI vs. MIL", "CHI @ DET", "CHI vs. CLE", "CHI @ IND", "CHI vs. ATL", "CHI @ MIA", "CHI vs. BOS", "CHI @ NYK", "CHI vs. PHI", "CHI @ TOR"],
          "PTS_stats": { "avg": 25.9, "med": 26.0, "sd": 5.02, "cov": 0.194 },
          "REB_stats": { "avg": 4.8, "med": 5.0, "sd": 1.25, "cov": 0.260 },
          "AST_stats": { "avg": 4.7, "med": 4.5, "sd": 1.27, "cov": 0.270 }
        },
        "advanced": {
          "USG_PCT": 28.5,
          "TS_PCT": 58.2,
          "OFF_RATING": 113.5,
          "DEF_RATING": 114.2,
          "PACE": 99.8
        },
        "splits": {
          "Home_PPG": 26.8,
          "Road_PPG": 24.5,
          "Home_RPG": 5.1,
          "Road_RPG": 4.3
        },
        "h2h": null,
        "prop_analytics": null,
        "fatigue": null
      }
    ],
    "WAS": [
      {
        "name": "Jordan Poole",
        "player_id": 1629673,
        "position": "G",
        "gamelog": {
          "name": "Jordan Poole",
          "games_played": 70,
          "PTS": [22, 18, 25, 15, 20, 28, 17, 23, 19, 21],
          "REB": [3, 2, 4, 2, 3, 5, 2, 4, 3, 3],
          "AST": [5, 4, 6, 3, 5, 7, 4, 5, 4, 6],
          "STL": [1, 0, 1, 0, 1, 2, 0, 1, 1, 0],
          "BLK": [0, 0, 0, 0, 1, 0, 0, 0, 0, 0],
          "FG3M": [2, 3, 4, 1, 2, 5, 1, 3, 2, 3],
          "MIN": [34, 32, 36, 30, 33, 38, 31, 35, 33, 34],
          "l10_dates": ["2026-04-13", "2026-04-11", "2026-04-09", "2026-04-07", "2026-04-05", "2026-04-03", "2026-04-01", "2026-03-30", "2026-03-28", "2026-03-26"],
          "l10_matchups": ["WAS @ BKN", "WAS vs. ORL", "WAS @ PHI", "WAS vs. CHA", "WAS @ ATL", "WAS vs. MIA", "WAS @ BOS", "WAS vs. NYK", "WAS @ TOR", "WAS vs. DET"],
          "PTS_stats": { "avg": 20.8, "med": 20.5, "sd": 3.82, "cov": 0.184 },
          "REB_stats": { "avg": 3.1, "med": 3.0, "sd": 0.94, "cov": 0.303 },
          "AST_stats": { "avg": 4.9, "med": 5.0, "sd": 1.14, "cov": 0.233 }
        },
        "advanced": {
          "USG_PCT": 25.2,
          "TS_PCT": 54.8,
          "OFF_RATING": 108.1,
          "DEF_RATING": 118.5,
          "PACE": 101.2
        },
        "splits": {},
        "h2h": null,
        "prop_analytics": null,
        "fatigue": null
      }
    ]
  },
  "key_defenders": {
    "CHI": [],
    "WAS": []
  },
  "injuries": {
    "CHI": {},
    "WAS": { "Kyle Kuzma": "Out" }
  },
  "usage_redistribution": {},
  "correlation_warnings": {}
}
